大学名,研究科,研究室名,キーワード,指定教科書,Amazonリンク,試験科目,公式リンク,英語要件,試験日程,過去問入手方法
東京大学,工学系研究科,松尾研究室,人工知能 ディープラーニング Webマイニング 起業,深層学習 (Goodfellow),https://amzn.to/dummy1,数学 専門科目(アルゴリズム・情報理工),https://weblab.t.u-tokyo.ac.jp/,TOEFL (スコア提出必須),8月下旬,専攻HPにて数年分公開中
東京大学,工学系研究科,山田研究室,蓄電池 エネルギー 化学工学 シミュレーション,電気化学測定マニュアル,https://amzn.to/dummy2,物理化学 化学工学 熱力学,https://www.chemsys.t.u-tokyo.ac.jp/,TOEFL (iBT推奨),8月下旬,専攻事務室にて閲覧・コピー可
東京大学,工学系研究科,幾原研究室,電子顕微鏡 セラミックス 結晶界面 ナノテクノロジー,材料科学の基礎,https://amzn.to/dummy3,材料組織学 量子力学 熱力学,http://prom.t.u-tokyo.ac.jp/,TOEFL (スコア提出),8月下旬,工学部プリントセンターで購入可能
京都大学,工学研究科,プロセス制御研究室,化学工学 プロセス制御 スマート工場 機械学習,ベーシック化学工学,https://amzn.to/dummy4,工業数学 物理化学 移動現象論,http://www-control.t.kyoto-u.ac.jp/,TOEIC / TOEFL,8月第1週,専攻事務室にて閲覧可
京都大学,工学研究科,材料設計分野(田中研),熱力学 CALPHAD 相平衡 状態図計算,マテリアルサイエンスの基礎熱力学,https://amzn.to/dummy5,金属組織学 材料熱力学 物理化学,http://www.mtl.kyoto-u.ac.jp/,TOEIC / TOEFL / IELTS,8月上旬,専攻HPより請求フォームあり
京都大学,工学研究科,野田研究室,フォトニック結晶 レーザー 量子エレクトロニクス 光工学,量子力学(1),https://amzn.to/dummy6,電磁気学 量子力学 電子回路,https://www.kuee.kyoto-u.ac.jp/,TOEFL (iBT/ITP),8月上旬,HPにて過去3年分公開